{"catalog_version":1,"generated_at":"2026-09-17T00:00:00Z","schema_version":3,"norm_version":"1.0.0","catalog_sqlite_zst":{"path":"catalog/catalog.sqlite.zst","bytes":1648,"sha256":"817d8a45e96cfa6468b139492305cc59090ee010955af45de7d6b8fcf500007e"},"books_base_url":"https://example.test/pages/","book_count":1,"min_app_version":"0.1.0"}
